{
  "schema_version": "provider-execution-plan-v1",
  "id": "joga-hairbands-starz-kid-campaign-plan",
  "provider_prompt_id": "86a2700978127971df0b86d0250c929670e1c6c14b32c7a1601bcb9755c77e46",
  "provider": "higgsfield",
  "model": "nano_banana_2",
  "method": "cost_estimate",
  "params": {
    "aspect_ratio": "4:3",
    "resolution": "2k"
  },
  "uploads": [],
  "media_inputs": [],
  "retries": {
    "max_attempts": 3,
    "backoff": "exponential"
  },
  "masks": [],
  "metadata": {
    "capability_registry_version": "v1-inline",
    "job_dir": "/Users/craigkunte/.local/state/sdk-executor/worktrees/sdk-executor-9f81572b0b2d/services/aragon/image-pipeline/jobs/joga-hairbands",
    "accepts_reference": true,
    "content_hash": "e06bec8be98893dbc0f7aeca3b1166274d6b45a10c5e4a3071380dfeb3c7b92a"
  },
  "prompt": {
    "positive": "Studio lifestyle photograph for the JOGA Starz Kid campaign: a young athlete aged 10-13 wearing a royal-blue JOGA hairband, the product clearly visible on the head. The band region must remain unoccluded and read as royal blue with the white JOGA wordmark legible (scene lock: band_visibility). Eye-level medium-close camera, soft key and fill lighting, energetic youth-athletics mood, studio lifestyle style. subject centered, band readable, chest mark optional. Background: neutral studio grey backdrop.",
    "negative": null
  },
  "output": {
    "imgtype": "hero",
    "aspect_ratio": "4:3",
    "resolution": "2k",
    "count": 1,
    "background": "neutral studio grey backdrop",
    "composition": "subject centered, band readable, chest mark optional"
  }
}
