{
  "schema_version": "provider-execution-plan-v1",
  "id": "joga-hairbands-edit-remove-element-plan",
  "provider_prompt_id": "ed4a9f3240e6afdb5877d21d2c525b6188cb3426335c606a8f86ec85a95ce6b8",
  "provider": "higgsfield",
  "model": "nano_banana_2",
  "method": "cost_estimate",
  "params": {
    "resolution": "2k",
    "_negative_appended": true
  },
  "uploads": [],
  "media_inputs": [],
  "retries": {
    "max_attempts": 3,
    "backoff": "exponential"
  },
  "masks": [],
  "metadata": {
    "capability_registry_version": "v1-inline",
    "job_dir": "/Users/craigkunte/.local/state/sdk-executor/worktrees/sdk-executor-9f81572b0b2d/services/aragon/image-pipeline/jobs/joga-hairbands",
    "accepts_reference": true,
    "content_hash": "2bc47307743c0100baaf6779912d4f4f17c369cb44fbf9bb59582c858f61f18b"
  },
  "prompt": {
    "positive": "Re-render reference image 1 in place. Lock the child, hairband, hands, pose, lighting, background and kit colours exactly.\n\nONLY CHANGES:\n1. Remove completely the Joma J element from the jersey chest.\n2. Remove completely the white swoosh element from the jersey chest.\n3. Reconstruct plain royal-blue jersey fabric with natural weave and lighting where the removed elements were.\n\nDo not crop the product. Do not alter anything else.",
    "negative": "joma_j, white_swoosh, crop_product, joma_j, white_swoosh, crop_product"
  },
  "output": {
    "imgtype": "edit",
    "resolution": "2k",
    "count": 1
  }
}
